entity_id,entity_name,data
e1,Product A,Great product with excellent features and high quality
e2,Product B,Good quality and fast delivery service
e3,Product C,Average product, could be better but affordable
e4,Product D,Outstanding service and customer support
e5,Product E,Decent product at reasonable price point
e6,Product F,Premium product with advanced features and warranty
e7,Product G,Budget-friendly option with basic functionality
e8,Product H,Innovative design with modern technology integration
e9,Product I,Reliable product with consistent performance
e10,Product J,Versatile product suitable for multiple use cases
e11,Product K,Durable construction with long-lasting materials
e12,Product L,Eco-friendly design with sustainable materials
e13,Product M,Compact size ideal for small spaces
e14,Product N,Professional grade for commercial use
e15,Product O,User-friendly interface with intuitive controls
e16,Product P,High-performance model with rapid processing
e17,Product Q,Stylish design with modern aesthetics
e18,Product R,Multipurpose tool for various applications
e19,Product S,Energy-efficient with low power consumption
e20,Product T,Top-rated with excellent customer reviews
e21,Product U,Robust build quality with comprehensive warranty coverage
e22,Product V,Sleek design with premium finish and attention to detail
e23,Product W,Flexible configuration options for custom workflows
e24,Product X,Quick setup and easy integration with existing systems
e25,Product Y,Cost-effective solution without compromising on core features
e26,Product Z,Enterprise-ready with advanced security and compliance
e27,Product AA,Lightweight and portable for on-the-go usage
e28,Product AB,Scales well for both individual and team use
e29,Product AC,Backed by responsive support and regular updates
e30,Product AD,Optimized for performance in demanding environments
e31,Product AE,Clean aesthetics that fit any workspace or home
e32,Product AF,Proven track record with high satisfaction scores
e33,Product AG,Modular design allows expansion as needs grow
e34,Product AH,Efficient operation with minimal maintenance required
e35,Product AI,Well-documented with clear instructions and examples
e36,Product AJ,Competitive pricing with frequent promotions
e37,Product AK,Trusted brand with years of industry experience
e38,Product AL,Smooth user experience with minimal learning curve
e39,Product AM,Designed for durability under heavy daily use
e40,Product AN,Best-in-class value for budget-conscious buyers
